{
  "$schema": "https://json-schema.org/draft/2020-12/schema",
  "$id": "https://collider.local/skills/schemas/storybook-version-policy.schema.json",
  "title": "Storybook Version Policy",
  "description": "The declared Storybook baseline: one exact version line, the addons that must be present, the modern import paths stories must use, and the legacy packages that must not come back. Fully portable — every value here is a repo's own choice, but the shape is not.",
  "type": "object",
  "required": [
    "policyVersion",
    "framework",
    "storybookVersion",
    "requiredAddons",
    "requiredImports"
  ],
  "additionalProperties": false,
  "properties": {
    "policyVersion": { "type": "string", "minLength": 1 },
    "baselineDate": {
      "type": "string",
      "pattern": "^\\d{4}-\\d{2}-\\d{2}$",
      "description": "When this baseline was last deliberately reviewed, not when the file was last edited."
    },
    "framework": {
      "type": "string",
      "minLength": 1,
      "description": "The Storybook framework package, e.g. @storybook/nextjs-vite."
    },
    "storybookVersion": {
      "type": "string",
      "pattern": "^\\d+\\.\\d+\\.\\d+$",
      "description": "Exact major.minor.patch. Ranges are the drift this file exists to prevent."
    },
    "requiredAddons": {
      "type": "array",
      "minItems": 1,
      "uniqueItems": true,
      "items": { "type": "string", "minLength": 1 }
    },
    "requiredImports": {
      "type": "object",
      "required": ["test", "previewApi", "actions"],
      "additionalProperties": { "type": "string", "minLength": 1 },
      "description": "Modern import paths stories must use. Keys beyond the three required ones are allowed as Storybook's surface grows.",
      "properties": {
        "test": { "type": "string", "minLength": 1 },
        "previewApi": { "type": "string", "minLength": 1 },
        "actions": { "type": "string", "minLength": 1 }
      }
    },
    "disallowedLegacyPackages": {
      "type": "array",
      "uniqueItems": true,
      "items": { "type": "string", "minLength": 1 },
      "description": "Packages an upgrade should have removed. Present here so a reintroduction is a policy failure, not a code review miss."
    },
    "configFiles": {
      "type": "array",
      "uniqueItems": true,
      "items": { "type": "string", "minLength": 1 }
    },
    "validationCommands": {
      "type": "array",
      "uniqueItems": true,
      "items": { "type": "string", "minLength": 1 },
      "description": "The commands that enforce this policy. Keep in sync with the repo's package scripts — a command listed here that no longer exists is drift."
    },
    "notes": {
      "type": "array",
      "items": { "type": "string", "minLength": 1 }
    }
  }
}
